{
  "metadataType": "FunctionPage",
  "createdBy": "ModelingAI",
  "createdOn": "2025-10-23T08:41:52.551Z",
  "modifiedBy": "ModelingAI",
  "modifiedOn": "2025-10-23T08:41:52.551Z",
  "metadataStatus": "Customize",
  "functionPageId": "f8d44297-ac4f-462b-a187-16ab863495d5",
  "name": "4afc1445-86df-47f9-b0d8-c9a5f1e91033",
  "application": "x_0338",
  "functionGUID": "47aaa7f6-55ea-485d-82ad-3acee93988ec",
  "functionCode": "x_03381001",
  "title": "图书信息列表页面",
  "pageName": "图书信息列表页面",
  "description": "图书信息管理列表页面，支持查询和增删改查操作",
  "titleEn": "bookInfoListPage",
  "pageType": "0",
  "titleSuffix": "列表页面",
  "url": "/std/x_03381001/4afc1445-86df-47f9-b0d8-c9a5f1e91033",
  "page": {
    "events": [
      {
        "name": "control.ready",
        "functionName": "Mysoft.tsglxt.Mx_03381001.bookInfoListPage",
        "enabled": true
      }
    ]
  },
  "pageLayout": {
    "pageLayoutCategory": "OneColumn",
    "layoutType": "0",
    "pageMargin": "0",
    "pageHeightSetting": "Repeat",
    "cells": [
      {
        "id": "896c5a67-bae7-4675-b1f9-049bbd744260",
        "width": "100%",
        "height": "100%",
        "isHidden": false,
        "rowIndex": "0",
        "direction": "column",
        "cells": [
          {
            "id": "6fecf8ee-967f-4564-8140-3b3167ea599e",
            "width": "100%",
            "height": "100%",
            "isHidden": false,
            "rowIndex": "0",
            "direction": "column",
            "control": {
              "id": "x_appGrid1",
              "type": "Mysoft.Map6.Modeling.Controls.AppGrid",
              "metadataId": "5cdc30c0-9a51-4c2a-9e6c-5abf7b64f47f",
              "autoHeight": "1"
            }
          }
        ]
      }
    ]
  }
}